date,law,source,snapshot,message
2013-05-01,Archivo Digital de la Legislacion del Peru - texto actualizado al 1 de mayo de 2013,https://leyes.congreso.gob.pe/Documentos/constituciones_ordenado/CONSTIT_1993/Texto_actualizado_CONS_1993.pdf,snapshots/2013-05-01.md,Agrega snapshot oficial intermedio de la Constitucion Politica del Peru actualizado al 1 de mayo de 2013
2015-03-10,Ley 30305,https://www.congreso.gob.pe/diariodebates/leyesrefconstit/ley30305,snapshots/2015-03-10.md,Modifica los articulos 191 194 y 203 sobre denominacion y no reeleccion inmediata de autoridades regionales y alcaldes
2017-05-09,Ley 30558,https://leyes.congreso.gob.pe/Documentos/2016_2021/ADLP/Texto_Consolidado/30558-TXM.pdf,snapshots/2017-05-09.md,Modifica el literal f del inciso 24 del articulo 2 sobre detencion policial
2017-06-22,Ley 30588,https://leyes.congreso.gob.pe/Documentos/2016_2021/ADLP/Texto_Consolidado/30588-TXM.pdf,snapshots/2017-06-22.md,Incorpora el articulo 7-A sobre acceso al agua potable
2024-12-11,Edicion oficial del Congreso de la Republica - diciembre 2024,https://www3.congreso.gob.pe/Docs/files/constitucion/constitucion-12-2024.pdf,snapshots/2024-12-11.md,Agrega snapshot completo de la Constitucion Politica del Peru segun la edicion oficial de diciembre de 2024
